<?xml version="1.0" encoding="UTF-8"?>
<MetodosEstudo xmlns:xsi="http://www.w3.org/2001/XMLSchema-instance"
               xsi:noNamespaceSchemaLocation="MetodosEstudo.xsd">
    
    <Introducao>
        <Importancia>Estudar de forma eficaz é essencial para alcançar bons resultados académicos com menos esforço.</Importancia>
        <Objetivo>Usar métodos certos ajuda-te a reter mais informação, a concentrar-te melhor e a usar o teu tempo de forma inteligente.</Objetivo>
    </Introducao>

    <MetodosPrincipais>
        <Metodo nome="Pomodoro">
            <Descricao>Técnica que divide o estudo em blocos de 25 minutos com pausas curtas.</Descricao>
            <Vantagens>Aumenta o foco, combate a procrastinação, melhora a gestão do tempo.</Vantagens>
            <Desvantagens>Pode interromper o raciocínio em tarefas que exigem concentração contínua.</Desvantagens>
            <IdealPara>Estudo prolongado, tarefas repetitivas ou com dificuldade de foco.</IdealPara>
        </Metodo>
        <Metodo nome="Mapas Mentais">
            <Descricao>Diagramas que organizam ideias de forma visual e ramificada.</Descricao>
            <Vantagens>Facilita a memorização, estimula a criatividade e a compreensão global.</Vantagens>
            <Desvantagens>Pode ser confuso se mal estruturado; menos eficaz para conteúdos lineares.</Desvantagens>
            <IdealPara>Revisão de matérias complexas, planeamento de ideias, brainstorming.</IdealPara>
        </Metodo>
        <Metodo nome="Flashcards">
            <Descricao>Cartões com perguntas e respostas para revisão ativa e espaçada.</Descricao>
            <Vantagens>Reforça a memória, permite autoavaliação e personalização do conteúdo.</Vantagens>
            <Desvantagens>Pode ser demorado criar; menos útil para matérias conceptuais.</Desvantagens>
            <IdealPara>Vocabulário, definições, fórmulas, datas e detalhes específicos.</IdealPara>
        </Metodo>
        <Metodo nome="Autoexplicação">
            <Descricao>Explicar a matéria com as próprias palavras, como se estivesse a ensinar.</Descricao>
            <Vantagens>Promove a compreensão profunda, detecta lacunas no conhecimento.</Vantagens>
            <Desvantagens>Exige mais tempo e energia; difícil para quem não tem domínio prévio do tema.</Desvantagens>
            <IdealPara>Estudo individual, preparação para testes escritos e orais.</IdealPara>
        </Metodo>
    </MetodosPrincipais>

    <PassosEstudoEficaz>
        <Passo>Definir os seus objetivos</Passo>
        <Passo>Avaliar o seu tempo disponível</Passo>
        <Passo>Identificar as suas prioridades</Passo>
        <Passo>Criar um cronograma</Passo>
        <Passo>Reservar tempo para as revisões</Passo>
        <Passo>Manter o foco e a disciplina</Passo>
    </PassosEstudoEficaz>

    <TecnicasAdicionais>
        <Tecnica nome="Leitura Ativa">Envolve questionar, resumir e refletir sobre o que lês.</Tecnica>
        <Tecnica nome="Revisão Espaçada">Rever a matéria várias vezes ao longo do tempo.</Tecnica>
        <Tecnica nome="Elaboração">Aplicar técnicas eficazes para melhorar a compreensão e retenção.</Tecnica>
        <Tecnica nome="Resumos Visuais">Criar mapas mentais ou esquemas para ajudar a memorizar.</Tecnica>
    </TecnicasAdicionais>

    <RecursosUteis>
        <Recurso nome="Escola Virtual" url="https://www.escolavirtual.pt/">Fichas e resumos escolares.</Recurso>
        <Recurso nome="Khan Academy" url="https://www.khanacademy.org/">Vídeos e exercícios para várias disciplinas.</Recurso>
        <Recurso nome="Quizlet" url="https://quizlet.com/">Criação de flashcards e jogos educativos.</Recurso>
        <Recurso nome="Focus Keeper" url="https://www.focuskeeper.app/">App Pomodoro para concentração.</Recurso>
        <Recurso nome="EducaLab" url="https://www.educalab.pt/">Recursos digitais para alunos e professores.</Recurso>
    </RecursosUteis>

</MetodosEstudo>